{
  "schema_version": "0.1",
  "generated_at": "2026-10-21T00:00:00+00:00",
  "tool": "tests/fixtures/filmcraft",
  "brief": {
    "text": "a tiny synthetic paired rough cut for the FilmCraft export tests",
    "target_duration_s": null,
    "order": "chronological",
    "pacing": "uniform"
  },
  "sources": [
    {
      "file": "camera 2026-10-17 22-25-44.mp4",
      "path": "/rec/camera 2026-10-17 22-25-44.mp4",
      "duration_s": 10.0,
      "media_type": "video"
    },
    {
      "file": "2026-10-17 22-25-44.mp4",
      "path": "/rec/2026-10-17 22-25-44.mp4",
      "duration_s": 10.0,
      "media_type": "video"
    }
  ],
  "video": [
    {
      "id": "w001",
      "clip": "2026-10-17 22-25-44.mp4",
      "in_s": 1.0,
      "out_s": 3.0,
      "score": 1.0,
      "reason": "start: session"
    },
    {
      "id": "w001",
      "clip": "camera 2026-10-17 22-25-44.mp4",
      "in_s": 1.35,
      "out_s": 3.35,
      "score": 1.0,
      "reason": "start: session"
    }
  ],
  "decisions": [],
  "meta": {
    "tool": "tests/fixtures/filmcraft",
    "wall_time_s": 0.0,
    "llm_cost_usd": 0.0
  }
}
